{
  "profile": "indexed-source-windows-1.0",
  "id": "demo_arterial_windows",
  "dataset_id": "mimic-iv-demo-2.2",
  "calendar_basis": {
    "kind": "declared_same_release_patient_calendar",
    "reason": "Conditional record-window selection within one patient in pinned MIMIC-IV demo 2.2, whose release documentation describes consistent date shifting: https://physionet.org/content/mimic-iv-demo/2.2/ . This is a computational assumption, not clinical approval or physical elapsed-time verification."
  },
  "query": {
    "profile": "mixed-record-trajectory-1.0",
    "id": "synthetic_pressure_followup",
    "treatment_class_iri": "https://example.org/trajectory/mimic-record-item/221906",
    "baseline": {
      "item_ids": [
        "220052"
      ],
      "unit_lexical": "mmHg",
      "operator": "lt",
      "value_lexical": "65",
      "min_before_start_us": 1,
      "max_before_start_us": 1800000000
    },
    "followup": {
      "item_ids": [
        "220052"
      ],
      "unit_lexical": "mmHg",
      "anchor": "start",
      "min_after_anchor_us": 0,
      "max_after_anchor_us": 7200000000,
      "within_interval": false
    }
  }
}
